{
  "formatVersion": 1,
  "taskType": "information_request",
  "briefVersion": 1,
  "issueState": "issued",
  "ownerPersonId": "fictional-owner",
  "objective": "Identify the quotation contact and fields for a fictional customer.",
  "includedScope": [
    "Describe the existing quotation workflow."
  ],
  "excludedScope": [
    "Design a new CRM or approve additional scope."
  ],
  "completionCriteria": [
    "Identify the responsible role and requested enquiry fields."
  ],
  "items": [
    {
      "id": "q-contact",
      "prompt": "Who handles quotation enquiries?",
      "required": true
    },
    {
      "id": "q-fields",
      "prompt": "Which fields do you need on an enquiry?",
      "required": true
    }
  ]
}
